{
  "kind": "franz-lola-content",
  "schemaVersion": 2,
  "type": "object",
  "id": "zauberberg-note",
  "name": "Zauberberg-Note",
  "description": "Die echte cyanfarbene Note von der Zauberberg-Bühne.",
  "document": {
    "id": "zauberberg-note",
    "name": "Zauberberg-Note",
    "category": "Zauberberg",
    "description": "Die echte cyanfarbene Note von der Zauberberg-Bühne.",
    "type": "custom",
    "width": 2,
    "height": 3,
    "color": "#63d9d4",
    "label": "♪",
    "appearance": {
      "width": 8,
      "height": 12,
      "palette": [
        "transparent",
        "#63d9d4"
      ],
      "pixels": [
        "00011000",
        "00011110",
        "00011010",
        "00011010",
        "00011000",
        "00011000",
        "00011000",
        "00011000",
        "00111000",
        "01111000",
        "01110000",
        "00000000"
      ],
      "animations": [
        {
          "id": "idle",
          "fps": 4,
          "duration": 0.25,
          "loop": true,
          "keyframes": [
            {
              "id": "keyframe-1",
              "time": 0,
              "easing": "step",
              "pixels": [
                "00011000",
                "00011110",
                "00011010",
                "00011010",
                "00011000",
                "00011000",
                "00011000",
                "00011000",
                "00111000",
                "01111000",
                "01110000",
                "00000000"
              ]
            }
          ]
        }
      ],
      "stateAnimations": {
        "idle": "idle",
        "up": "idle",
        "right": "idle",
        "down": "idle",
        "left": "idle"
      }
    },
    "animation": {
      "type": "bob",
      "speed": 1.1,
      "amplitude": 0.125
    },
    "effects": [
      {
        "id": "buehnen-neon",
        "type": "neon",
        "intensity": 0.65,
        "speed": 1.2,
        "color": "#63d9d4"
      }
    ]
  },
  "dependencies": [],
  "references": []
}
