{
  "kind": "franz-lola-content",
  "schemaVersion": 2,
  "type": "object",
  "id": "concert-speaker",
  "name": "Konzertbox",
  "description": "Eine kräftige Pixelbox für Rock, Punk und Metal.",
  "document": {
    "id": "concert-speaker",
    "name": "Konzertbox",
    "category": "Zauberberg",
    "description": "Eine kräftige Pixelbox für Rock, Punk und Metal.",
    "type": "custom",
    "width": 2,
    "height": 2,
    "color": "#ff4f87",
    "label": "▣",
    "appearance": {
      "width": 8,
      "height": 8,
      "palette": [
        "transparent",
        "#34203f",
        "#ff4f87"
      ],
      "pixels": [
        "00000000",
        "01111110",
        "01222210",
        "01211210",
        "01222210",
        "01211210",
        "01111110",
        "00000000"
      ],
      "animations": [
        {
          "id": "idle",
          "fps": 4,
          "duration": 0.25,
          "loop": true,
          "keyframes": [
            {
              "id": "keyframe-1",
              "time": 0,
              "easing": "step",
              "pixels": [
                "00000000",
                "01111110",
                "01222210",
                "01211210",
                "01222210",
                "01211210",
                "01111110",
                "00000000"
              ]
            }
          ]
        }
      ],
      "stateAnimations": {
        "idle": "idle",
        "up": "idle",
        "right": "idle",
        "down": "idle",
        "left": "idle"
      }
    },
    "animation": {
      "type": "pulse",
      "speed": 0.55,
      "amplitude": 0.06
    },
    "effects": [
      {
        "id": "bass-echo",
        "type": "echo",
        "intensity": 0.45,
        "speed": 1.8,
        "color": "#ff4f87"
      }
    ]
  },
  "dependencies": [],
  "references": []
}
