{
  "kind": "franz-lola-content",
  "schemaVersion": 2,
  "type": "object",
  "id": "music-note",
  "name": "Musiknote",
  "description": "Eine frei verwendbare goldene Musiknote.",
  "document": {
    "id": "music-note",
    "name": "Musiknote",
    "category": "Musik",
    "description": "Eine frei verwendbare goldene Musiknote.",
    "type": "custom",
    "width": 2,
    "height": 2,
    "color": "#f5c451",
    "label": "♪",
    "appearance": {
      "width": 12,
      "height": 12,
      "palette": [
        "transparent",
        "#f5c451"
      ],
      "pixels": [
        "000000110000",
        "000000111100",
        "000000100100",
        "000000100100",
        "000000100100",
        "000000100100",
        "000011100000",
        "000111100000",
        "000111000000",
        "000000000000",
        "000000000000",
        "000000000000"
      ],
      "animations": [
        {
          "id": "idle",
          "fps": 4,
          "duration": 0.25,
          "loop": true,
          "keyframes": [
            {
              "id": "keyframe-1",
              "time": 0,
              "easing": "step",
              "pixels": [
                "000000110000",
                "000000111100",
                "000000100100",
                "000000100100",
                "000000100100",
                "000000100100",
                "000011100000",
                "000111100000",
                "000111000000",
                "000000000000",
                "000000000000",
                "000000000000"
              ]
            }
          ]
        }
      ],
      "stateAnimations": {
        "idle": "idle",
        "up": "idle",
        "right": "idle",
        "down": "idle",
        "left": "idle"
      }
    },
    "animation": {
      "type": "bob",
      "speed": 1.1,
      "amplitude": 0.125
    }
  },
  "dependencies": [],
  "references": []
}
